slno	concept_id	concepticon_id	concepticon_name	name	gloss	concept	stage	category	definition	japanese	hindi	assamese	mandarin	burmese	nagamese	comment
1	0001.:one	1493	ONE	one	one	ᴏɴᴇ	1	numbers	The default numeral for one (1). // It should not include a numeral classifier, but instead be only the bare numeral.	一	एक	এক	一	တစ်		
2	0002.:two	1498	TWO	two	two	ᴛᴡᴏ	1	numbers	The natural number two (2). // It should not include a numeral classifier, but instead be only the bare numeral.	二	दो	দুই	二	နှစ်		
3	0003.:three	492	THREE	three	three	ᴛʜʀᴇᴇ	1	numbers	The natural number three (3). // It should not include a numeral classifier, but instead be only the bare numeral.	三	तीन	তিনি	三	သုံး		
4	0004.:four	1500	FOUR	four	four	ꜰᴏᴜʀ	1	numbers	The default numeral for four (4). It should not include a numeral classifier, but instead be only the bare numeral.	四	चार	চাৰি	四	လေး		
5	0005.:five	493	FIVE	five	five	ꜰɪᴠᴇ	1	numbers	The default numeral for five (5). It should not include a numeral classifier, but instead be only the bare numeral.	五	पांच	পাঁচ	五	ငါး		
6	0006.:six	1703	SIX	six	six	ꜱɪx	1	numbers	The natural number six (6). // It should not include a numeral classifier, but instead be only the bare numeral.	六	छह	ছয়	六	ခြောက်ခဲ့သည်		
7	0007.:seven	1704	SEVEN	seven	seven	ꜱᴇᴠᴇɴ	1	numbers	The natural number seven (7). // It should not include a numeral classifier, but instead be only the bare numeral.	七	सात	সাত	七	ခုနှစ်		
8	0008.:eight	1705	EIGHT	eight	eight	ᴇɪɢʜᴛ	1	numbers	The natural number eight (8). // It should not include a numeral classifier, but instead be only the bare numeral.	八	आठ	আঠ	八	ရှစ်		
9	0009.:nine	1483	NINE	nine	nine	ɴɪɴᴇ	1	numbers	The default numeral for nine (9). It should not include a numeral classifier, but instead be only the bare numeral.	九	नौ	নৱ	九	ကိုး		
10	0010.:ten	1515	TEN	ten	ten	ᴛᴇɴ	0	numbers	The default numeral for ten (10). It should not include a numeral classifier, but instead be only the bare numeral.	十	दस	দহ	十	ဆယ်		
20	0020.:twenty	1710	TWENTY	twenty	twenty	ᴛᴡᴇɴᴛʏ	2	numbers	The natural number twenty (20).		बीस	বিশ	二十	ပိသျှတ်		
100	0100.:hundred	1634	HUNDRED	hundred	hundred	ʜᴜɴᴅʀᴇᴅ	2	numbers	The natural number one hundred (100).		सौ	শত	百	ရာ		
501	1.du	2634	WE TWO	1 du	1.du	1.ᴅᴜ	2	pronouns	The speaker and exactly one other person. // The first person dual pronominal stem. In varieties which have this stem, it is typically derived from a proposed etymon #tsi. Varieties which lack stem suppletion for dual pronominal forms should have their compounds recorded as such.							
505	1.n.sg.excl	1130	WE (EXCLUSIVE)	1 n sg excl	1.n.sg.excl	1.ɴ.ꜱɢ.ᴇxᴄʟ	1	pronouns	Exclusive form of the non-singular and non-dual pronominal stem. This should only be filled out for languages which have a suppletive clusivity distinction.					ကျွန်တစ်ဦးတည်းနှင့်တကွ		
506	1.n.sg.incl	1131	WE (INCLUSIVE)	1 n sg incl	1.n.sg.incl	1.ɴ.ꜱɢ.ɪɴᴄʟ	1	pronouns	Inclusive form of the non-singular and non-dual pronominal stem. This should only be filled out for languages which have a suppletive clusivity distinction.					ကျွန်မှာတော့		
507	1.sg	1209	I	1 sg	1.sg	1.ꜱɢ	1	pronouns	The first-person singular pronominal stem, typically a reflex of PTB *ŋa or *ka.	わたし						
509	1000.:thousand	1843	THOUSAND	thousand	thousand	ᴛʜᴏᴜꜱᴀɴᴅ	2	numbers	The natural number one thousand (1000).		हजार	হাজাৰ	千	ထောင်		
512	2.n.sg	1213	YOU	2 n sg	2.n.sg	2.ɴ.ꜱɢ	1	pronouns	Second person non-singular pronominal stem. This will not likely have a suppletive dual counterpart.	おまえたち				သင့်တော်တို့		
513	2.sg	1215	THOU	2 sg	2.sg	2.ꜱɢ	1	pronouns	The second-person singular pronominal stem, typically but not always a reflex of *naŋ.	おまえ						
518	3.n.sg	817	THEY	3 n sg	3.n.sg	3.ɴ.ꜱɢ	1	pronouns	Third person non-singular pronominal stem, unmarked for gender. If gendered forms are attested they should be added under separate concepts.	彼ら，彼女ら				သူတို့		
519	3.sg	262	HE OR SHE OR IT	3 sg	3.sg	3.ꜱɢ	1	pronouns	Third person singular pronominal stem. This may in some cases also be one of the demonstrative stems, as is the case in much of Bodo-Garo.	彼，彼女						
526	above:to.be	1741	ABOVE	to be above	above	ᴀʙᴏᴠᴇ	2		Situated in a higher place than something else.		ऊपर	উপৰ	上面	အထက်		
530	accipitridae..raptor:::	2683	EAGLE OR HAWK	Accipitridae (raptor)	raptor	ʀᴀᴘᴛᴏʀ	2	fauna	A bird of prey with broad wings and a hooked bill. Kites are the most common which occur in the area. This should be the most general term for this class of birds, and not a compound term for a specific species. Any specific genera/species names should be noted separately.	鷹	चील		鹰	သိမ်းငှက်၊ လင်းယုန် သို့မဟုတ် စွန်ရဲ		
557	alcohol:brewed	404	ALCOHOL (FERMENTED DRINK)	brewed alcohol	brewed.alcohol	ʙʀᴇᴡᴇᴅ.ᴀʟᴄᴏʜᴏʟ	1		A fermented drink is a beverage containing alcohol because of a metabolic process that converts sugar to acids, gases and/or alcohol (e.g. beer or wine).		सुराही दार शराब	জলকীয় দ্রব	酿造酒	အရက်ချက်		
558	alcohol:distilled	842	LIQUOR	distilled alcohol	distilled.alcohol	ᴅɪꜱᴛɪʟʟᴇᴅ.ᴀʟᴄᴏʜᴏʟ	2		Alcoholic beverages made through distillation, such as whiskey or vodka. This will often be a borrowing, either from Tai or IA, though some varieties will retain a native form.	酒	अर्क	মদ	蒸馏酒	ပေါင်းခံအရက်		
565	alive:to.be	1422	BE ALIVE	to be alive	alive	ᴀʟɪᴠᴇ	2		To have life and be living, not dead.	生きている	जीवित	জিৱন থাকিব	活着	အသက်ရှင်ဖို့		
581	animal..general	619	ANIMAL	animal (general)	animal	ᴀɴɪᴍᴀʟ	2	fauna	Any living organism characterized by voluntary movement, the possession of cells with noncellulose cell walls and specialized sense organs enabling rapid response to stimuli, and the ingestion of complex organic substances such as plants and other animals.	動物	जानवर	পশু	动物	တိရစ္ဆာန်		
595	ant.:termite	883	TERMITE	termite	termite	ᴛᴇʀᴍɪᴛᴇ	2	fauna	A soft-bodied insect of the order Isoptera; individuals feed on cellulose and live in colonies with a caste system comprising three types of functional individuals: sterile workers and soldiers, and the reproductives.		दीमक	হুঁটুল	白蚁	ခြကောင်		
596	ant..general	587	ANT	ant (general)	ant	ᴀɴᴛ	1		Any of the black, red, brown, or yellow insects of the family Formicidae characterized by a large head and by living in organized colonies.	蟻	चींटी	পিঁপিলিকা	蚂蚁	ပုရွက်ဆိတ်		
628	arm..general	1673	ARM	arm (general)	arm	ᴀʀᴍ	2	body parts	One of the two upper extremeties of the human body, extending from the shoulder to the wrist. This should be the most general term, and will often include the hand as well. A term for arm which does not include the hand is not expected.	腕	बांह	বাঁহ		လက်		
632	arrow	977	ARROW	arrow	arrow	ᴀʀʀᴏᴡ	2		Pointed projectile that is shot with a bow.	矢	तीर	বাণ	箭头	မြှား		
635	ascend..move.up:to	705	GO UP (ASCEND)	to ascend (move up)	ascend	ᴀꜱᴄᴇɴᴅ	2		To move from a lower to a higher position by climbing. This should be distinct from the general go verbs which exist as part of systems of topographical deixis.	のぼる	चढ़ना		爬	တက်ရန် သို့မဟုတ် တက်ရန်		
636	ash	646	ASH	ash	ash	ᴀꜱʜ	1		The powdery incombustible residue left after the burning of a substance. Additional terms for different types of ash may be present, such as the stringy ash left over from burning dry bamboo. This concept is only for the most basic powdery type, but other forms should be documented as such.	灰	राख	বলি	灰烬	ပြာ		
638	ashamed:to.be	1894	ASHAMED	to be ashamed	ashamed	ᴀꜱʜᴀᴍᴇᴅ	2		Feeling shame or guilt. This is distinct from being shy.	恥じる						
654	awaken:to	1602	WAKE UP	to awaken	awaken	ᴀᴡᴀᴋᴇɴ	2		To stop sleeping and become conscious, to stir or come into awareness.	目覚める	जागना	জাগা	醒来	နိုးထရန်		
667	bamboo	1927	BAMBOO	bamboo	bamboo	ʙᴀᴍʙᴏᴏ	1	flora	A group of woody perennial evergreen plants in the true grass family Poaceae, subfamily Bambusoideae, tribe Bambuseae.	竹	बांस	ভেতি	竹子	ဝါး		
669	bamboo.shoot	2494	BAMBOO SHOOT	bamboo shoot	bamboo.shoot	ʙᴀᴍʙᴏᴏ.ꜱʜᴏᴏᴛ	2	flora	The edible shoots (new bamboo culms that come out of the ground) of many bamboo species // Often harvested as part of local cuisine, either used fresh, dried or fermented.	竹の子	बांस की खोखली	কাজি কেচেক	竹笋	မျှစ်		
677	banana..fruit	868	BANANA	banana (fruit)	banana	ʙᴀɴᴀɴᴀ	2	flora	The fruit of the banana tree.	バナナ	केला	কল	香蕉	ငှက်ပျောသီး		
679	banyan..tree	346	BANYAN	banyan (tree)	banyan	ʙᴀɴʏᴀɴ	2	flora	A large, tropical tree belonging to the genus Ficus, typically Ficus benghalensis, with aerial roots that grow into new trunks, often used for shade or as a spiritual symbol in many cultures.		बरगद		榕树	ညောင်ပင်		
689	basket..general	1539	BASKET	basket (general)	basket	ʙᴀꜱᴋᴇᴛ	2	artefacts	The general term for any kind of basket, a container woven typically from cane or bamboo used to store or carry many different kinds of items or materials.	籠						cf Chang _kam_
691	bat..animal	1793	BAT	bat (animal)	bat	ʙᴀᴛ	1	fauna	A small, flying mammal in the order Chiroptera with wings consisting of skin stretched over a framework of bones, typically active at night.	蝙蝠	चमगादड़		蝙蝠	လင်းနို့		
700	bean..general	832	BEAN	bean (general)	bean	ʙᴇᴀɴ	2		Any of various leguminous plants grown for their edible seeds and pods.	豆						
703	bear..animal	1820	BEAR	bear (animal)	bear	ʙᴇᴀʀ	2		A large beast of prey of the family Ursidae, related to the dog and raccoon, having shaggy hair, a very small tail, and flat feet.	熊	भालू		熊	ဝက်ဝံ		
717	bee..general	665	BEE	bee (general)	bee	ʙᴇᴇ	0	fauna	Any pollenating flying insect belonging to the Anthophila clade within the order Hymenoptera. Typically having yellow and black colouring with a striped pattern on the abdoment.	蜂	मधुमक्खी		蜜蜂	ပျား		
729	belly..exterior	1251	BELLY	belly (exterior)	belly	ʙᴇʟʟʏ	2	body parts	The lower part of the front of the torso (or a comparable part of an animal), confined by the upper side by the midriff and the lowerside by the pelvis. Contains the intestines.	腹	पेट		腹部	ဗိုက်၊အပြင်		
748	bird..general.term	937	BIRD	bird (general term)	bird	ʙɪʀᴅ	1	fauna	Any of the bipedal, warm-blooded vertebrates that lay eggs having wings which, for most species, enables them to fly.	鳥	पक्षी		鸟	ငှက်၊ ယေဘူယျ		
752	bite:to	1403	BITE	to bite	bite	ʙɪᴛᴇ	2		Clamping the teeth hard on something.	かみつく	काटना		咬	ကိုက်ရန်		
758	bitter:to.be	887	BITTER	to be bitter	bitter	ʙɪᴛᴛᴇʀ	2		Having an acrid taste, typical of citrus peel or bitter gourd Momordica charantia.	苦い	कड़वा		苦	ခါး		
775	blood	946	BLOOD	blood	blood	ʙʟᴏᴏᴅ	0	body parts	A fluid connective tissue consisting of the plasma and cells that circulate in the blood vessels.	血	रक्त		血液	သွေး		
776	bloom:to	3287	BLOOM	to bloom	bloom	ʙʟᴏᴏᴍ	2	flora	To bear flowers or to start bearing flowers; to blossom.		खिलना		开花	ပန်းတစ်ပွင့်၊		
779	blow..with.mouth:to	176	BLOW (WITH MOUTH)	to blow (with mouth)	blow	ʙʟᴏᴡ	2		To expel air through persed lips.		उड़ाना		吹	မှုတ်ရန်		
788	boil..liquid:to	792	BOIL (OF LIQUID)	to boil (liquid)	boil	ʙᴏɪʟ	2		To reach or cause to reach the temperature at which a liquid bubbles and turns to vapor by adding heat.	煮る	उबालना		煮沸	ပြုတ်ဖို့		
789	bone	1394	BONE	bone	bone	ʙᴏɴᴇ	1	body parts	Any of the components of an endoskeleton, consisting mainly of calcium phosphate, collagen and cells.	骨	हड्डी		骨头	အရိုး		
791	bone.marrow	1835	MARROW	bone marrow	bone.marrow	ʙᴏɴᴇ.ᴍᴀʀʀᴏᴡ	2	body parts	The spongy tissue in the hollow parts of bones.		हड्डी का मज्जा		骨髓	ရိုးတွင်းခြင်ဆီ		
793	born:to.be	1090	BE BORN	to be born	born	ʙᴏʀɴ	2		To come into existence, typically through childbirth.		जन्म लेना		出生	မွေးဖွားလာဖို့ရန်		
803	bow	994	BOW	bow	bow	ʙᴏᴡ	2		A weapon made of a curved piece of wood or other flexible material whose ends are connected by a string, used for shooting arrows, or a weapon based on it, consisting of a bow mounted on a stock.	弓	धनुष		弓	လေးကို		this should be split between bow and crossbow probably.
812	brain	1583	BRAIN	brain	brain	ʙʀᴀɪɴ	2	body parts	The organ of the central nervous system of an animal or human located in the skull that controls the actions and thoughts of the animal or human.	脳	मस्तिष्क		大脑	ဦးနှောက်		
819	breast	1402	BREAST	breast	breast	ʙʀᴇᴀꜱᴛ	2	body parts	The fleshy organ on the chest of a sexually mature human female containing mammary glands.	乳房	स्तन		乳房	ရင်သား		
825	bridge	1011	BRIDGE	bridge	bridge	ʙʀɪᴅɢᴇ	0		A structure that spans and provides a passage over a road, railway, river, or some other obstacle.	橋	पुल		桥	တံတား		
855	burn..intransitive:to	2102	BURN	to burn (intransitive)	burn	ʙᴜʀɴ	2		To put fire on something or to be on fire.		जलाना		烧	မီးရှို့ရန်		
867	buy:to	1869	BUY	to buy	buy	ʙᴜʏ	2		To obtain in exchange for money or goods.	買う	ख़रीदना		买	ဝယ်ရန်		
878	carry..child.on.back:to			to carry (child on back)	carry	ᴄᴀʀʀʏ	2			背負う						
939	child	2099	CHILD	child	child	ᴄʜɪʟᴅ	2		A young human being below the age of puberty or below the legal age of majority.	こども	बच्चा		儿童	ကလေး၊ မွေးကင်းစ		
944	chili.pepper	919	CHILI PEPPER	chili pepper	chili.pepper	ᴄʜɪʟɪ.ᴘᴇᴘᴘᴇʀ	1	flora	Any fruit of a plant of the botanical genus Capsicum, noted for their spicy and burning flavour due to presence of capsaicin.	唐辛子	मिर्च		辣椒	ငရုတ်သီးမှုန့်		
970	claw..animal	72	CLAW	claw (animal)	claw	ᴄʟᴀᴡ	2	body parts	The hard, keratin part growing at the feet of animals.	爪	पंजा		爪子	ခြေသည်း		
988	cloud..rain	1489	CLOUD	cloud (rain)	cloud	ᴄʟᴏᴜᴅ	1		A visible mass of condensed water vapor floating in the atmosphere, typically high above the ground.	雲	बादल		云	တိမ်တိုက်		
1007	cold..of.items:to.be	1287	COLD	to be cold (of items)	cold	ᴄᴏʟᴅ	2		Having a low temperature.		ठंडा होना		寒冷	အေးဖို့		
1010	cold..of.weather:to.be	2483	COLD (OF WEATHER)	to be cold (of weather)	cold	ᴄᴏʟᴅ	2		Having a low temperature (of the weather).	寒い	ठंडा मौसम		寒冷的天气	ရာသီဥတုအေး		
1015	colour.:black:to.be	163	BLACK	to be black	black	ʙʟᴀᴄᴋ	0		Of the very darkest color owing to the absence of or complete absorption of light, the opposite of white.	黒い	काला		黑	အနက်ရောင်		
1019	colour.:green:to.be	1425	GREEN	to be green	green	ɢʀᴇᴇɴ	2	statives	Having green as its colour; having the hue of that portion of the visible spectrum lying between yellow and blue, evoked in the human observer by radiant energy with wavelengths of approximately 490 to 570 nanometers.	緑の	हरा		绿色	အစိမ်းရောင်		
1023	colour.:red:to.be	156	RED	to be red	red	ʀᴇᴅ	0	statives	A color resembling the hue of blood, fire, or a ripe tomato.	赤い	लाल		红色	အနီေရာင်		
1024	colour.:white:to.be	1335	WHITE	to be white	white	ᴡʜɪᴛᴇ	0	statives	A color characterized by the presence of all wavelengths of visible light, often associated with purity or innocence.	白い	सफ़ेद		白色的	အဖြူ		
1046	cook..general:to	1100	COOK (SOMETHING)	to cook (general)	cook	ᴄᴏᴏᴋ	2		To prepare food by heating it.	料理する	पकाना		烹饪	ချက်ပြုတ်ရန်		
1062	count:to	1420	COUNT	to count	count	ᴄᴏᴜɴᴛ	2		To determine the amount of something or to enumerate the digits of one's numeral system.	数える	गिनना		数数	ရေတွက်ရန်		
1129	day::time	1225	DAY (NOT NIGHT)	daytime	daytime	ᴅᴀʏᴛɪᴍᴇ	2		The period between sunrise and sunset where one enjoys daylight.	昼	दिन का समय		白天	နေ့ဘက်		
1157	descend..move.down:to	2014	GO DOWN (DESCEND)	to descend (move down)	descend	ᴅᴇꜱᴄᴇɴᴅ	2		To move downward or to a lower place. Distinct from moving downriver, descent is opposite to the concept of climbing.	おりる	उतरना		下降	ဆင်းရန်		
1166	die:to	1494	DIE	to die	die	ᴅɪᴇ	1		To cease to live.	死ぬ	मरना		死	သေဖို့		
1170	dig:to	1418	DIG	to dig	dig	ᴅɪɢ	1		To move earth, rocks, etc. out of the way, usually to create a hole.	掘る	खोदना		挖	တူးရန်		
1175	discard..throw.away:to	3696	THROW AWAY	to discard (throw away)	discard	ᴅɪꜱᴄᴀʀᴅ	2			捨てる						
1194	dog	2009	DOG	dog	dog	ᴅᴏɢ	2	fauna	A domesticated carnivorous mammal, Canis familiaris, with a pointed snout, a long tail, and a coat of fur, often kept as a pet or trained for hunting or guarding.	犬	कुत्ता		狗	ခွေး		
1202	dove	1853	DOVE	dove	dove	ᴅᴏᴠᴇ	2	fauna	One of several birds of the family Columbidae.	鳩	फाख्ता		鸽子	ချိုး		
1210	dream:to	1920	DREAM (SOMETHING)	to dream	dream	ᴅʀᴇᴀᴍ	1		To experience a series of images, thoughts, and sensations during sleep, often accompanied by emotions and creating a sense of reality.	夢を見る	सपना देखना		做梦	အိပ်မက်မက်ဖို့		
1214	drink:to	1401	DRINK	to drink	drink	ᴅʀɪɴᴋ	0		To consume a liquid through the mouth.	飲む	पीना		喝	သောက်ရန်		
1239	ear	1247	EAR	ear	ear	ᴇᴀʀ	2	body parts	The organ of hearing, consisting of the pinna, auditory canal, eardrum, malleus, incus, stapes and cochlea.	耳	कान		耳朵	နား		
1247	earth..area.or.plot	1228	EARTH (SOIL)	earth (area or plot)	earth	ᴇᴀʀᴛʜ	2		The soft and loose material forming a great part of the Earth surface.							
1249	east	1877	EAST	east	east	ᴇᴀꜱᴛ	2		One of the four principal compass points, specifically 90°, conventionally directed to the right on maps. The direction of the rising sun.	東	पूर्व		东	အရှေ့		
1251	eat:.hard:to	1336	EAT	to eat	eat	ᴇᴀᴛ	2	verbs	To take food into the body through the mouth and swallow it. As applies to hard foods such as curries.		खाना खाना		吃	စားရန်		
1252	eat:.soft:to	1336	EAT	to eat	eat	ᴇᴀᴛ	2	verbs	To take food into the body through the mouth and swallow it. As applies to rice and soft foots.		खाना खाना		吃	စားရန်		
1259	egg..general	744	EGG	egg (general)	egg	ᴇɢɢ	2	body parts	The oval reproductive body laid by female birds, containing the embryo and nutrients for its growth.	卵	चिड़िया का अंडा		鸟蛋	ငှက်ဥ		
1281	emerge:to	1076	EMERGE (APPEAR)	to emerge	emerge	ᴇᴍᴇʀɢᴇ	2		To come out from a hidden or enclosed place.		उभरना		浮现	ပေါ်ထွက်လာရန်		
1314	extinguish..fire:to	127	EXTINGUISH	to extinguish (fire)	extinguish	ᴇxᴛɪɴɢᴜɪꜱʜ	2	verbs	To make something stop burning.	火を消す	बुझाना		熄灭	ငြိမ်းအေးရန်		
1315	eye	1248	EYE	eye	eye	ᴇʏᴇ	0	body parts	The organ that is sensitive to light, which it converts to electrical signals passed to the brain, by which means animals and humans see.	目	आँख		眼睛	မျက်လုံး		
1327	fall..of.objects:to	1280	FALL	to fall (of objects)	fall	ꜰᴀʟʟ	2		To descend in free fall due to the effect of gravity.	落ちる	गिरना		落下	အရွက်များကဲ့သို့ ကြွေကျခြင်း၊		
1338	far:to.be	1406	FAR	to be far	far	ꜰᴀʀ	2		Having a large intervening distance with regard to something.	遠い	दूर		远	ဝေးဖို့		
1344	fat:to.be	1279	FAT (OBESE)	to be fat	fat	ꜰᴀᴛ	2		Carrying a larger-than-normal amount of fat or weight.	太った, 太い	मोटा		肥	အဆီကျဖို့		
1345	fat..substance	323	FAT (ORGANIC SUBSTANCE)	fat (substance)	fat	ꜰᴀᴛ	2		Oily substance as part of animal flesh.							
1346	father	1217	FATHER	father	father	ꜰᴀᴛʜᴇʀ	1		A male parent.	父	पिता		父亲	အဖေ		
1348	fear:to	1419	FEAR (BE AFRAID)	to fear	fear	ꜰᴇᴀʀ	2		To be scared of; to have an uncontrollable emotion of anxiety about something that causes a scared reaction or frightening impression.	恐れる	डरना		害怕	ကြောက်ဖို့ကောင်းတယ်။		
1351	feather	1201	FEATHER	feather	feather	ꜰᴇᴀᴛʜᴇʀ	2	body parts	A branching, hair-like structure that grows on the skin of birds and protects them against coldness and water and allows their wings to create lift.	羽毛	पंख		羽毛	အမွေး		
1360	ferment..alcohol:to			to ferment (alcohol)	ferment	ꜰᴇʀᴍᴇɴᴛ	2									
1365	festival	131	FESTIVAL	festival	festival	ꜰᴇꜱᴛɪᴠᴀʟ	2		A day or period of celebration, typically for religious, cultural, or historical reasons.	祭	त्योहार		节日	ပွဲတော်		
1372	field:jhum	2794	FIELD (UPLAND)	jhum field	jhum.field	ᴊʜᴜᴍ.ꜰɪᴇʟᴅ	2		A type of slash-and-burn agriculture used in various parts of the world, in which the land is cleared of vegetation and burned to provide fertilizer.	焼畑	झुम का खेत		烧林放牧	ခုတ်ထစ်ခြင်းနှင့် မီးရှို့ခြင်းအကွက်		
1373	field:paddy	140	PADDY FIELD	paddy field	paddy.field	ᴘᴀᴅᴅʏ.ꜰɪᴇʟᴅ	2		A flooded field in which rice is grown.		धान का खेत		水稻田	လယ်ကွင်း		
1389	finger	1303	FINGER	finger	finger	ꜰɪɴɢᴇʀ	1	body parts	One of the long extremities of the hand that is used for gripping objects.	指	उंगली	আঙুল	手指	လက်ညှိုး		
1390	finger::nail	1258	FINGERNAIL	fingernail	fingernail	ꜰɪɴɢᴇʀɴᴀɪʟ	2	body parts	The hard, flat, translucent covering near the tip of a human finger, useful for scratching and fine manipulation.	爪	नाखून		指甲	လက်သည်း		
1396	finger.:thumb	1781	THUMB	thumb	thumb	ᴛʜᴜᴍʙ	2		The shortest and thickest of the fingers that can be placed against the others in order to create a firm grip.		अंगूठा	আঙুঠ	拇指	လက်မ		
1399	fire	221	FIRE	fire	fire	ꜰɪʀᴇ	0		The state of combustion in which inflammable material burns, producing heat, flames and often smoke.	火	आग		火	မီး		
1402	fire::wood	10	FIREWOOD	firewood	firewood	ꜰɪʀᴇᴡᴏᴏᴅ	2		Wood intended to be burned.	薪	लकड़ी		柴火	ထင်း		
1407	fish	227	FISH	fish	fish	ꜰɪꜱʜ	2	fauna	A cold-blooded vertebrate animal that lives in water that moves with the help of fins and breathes using gills (Pisces).	魚	मछली		鱼	ငါး		
1425	flat:to.be	1633	FLAT	to be flat	flat	ꜰʟᴀᴛ	2		Having an surface, without hills or bumps. Distinct from level. This concept may refer to any object and may be at any angle. It is distinct from level.	平たい	समतल		平的	ပြားချပ်		
1429	flee..run.away:to	956	FLEE	to flee (run away)	flee	ꜰʟᴇᴇ	2		Leaving a dangerous or unpleasant situation.	逃げる	भागना		奔跑 / 逃跑	ပြေး၊ ပြေး		
1438	flower	239	FLOWER	flower	flower	ꜰʟᴏᴡᴇʀ	0	flora	The reproductive structure of angiosperm plants, consisting of stamens and carpels surrounded by petals and sepals all borne on the receptacle.	花	फूल		花	ပန်း		
1441	fly:to	1441	FLY (MOVE THROUGH AIR)	to fly	fly	ꜰʟʏ	1		To move autonomously through the air, without any part of the object or object's enclosure touching anything attached to the ground.	飛ぶ	उड़ना		飞	ပျံသန်းရန်		
1444	fog..mist	249	FOG	fog (mist)	fog	ꜰᴏɢ	2		Water droplets or, rarely, ice crystals suspended in the air in sufficient concentration to reduce visibility appreciably.	霧	कोहरा		雾	မြူ၊ မြူ		
