slno	concept_id	concepticon_id	concepticon_name	name	gloss	concept	stage	category	definition	japanese	hindi	assamese	mandarin	burmese	nagamese	comment
2438	rope	1218	ROPE	rope	rope	ʀᴏᴘᴇ	2.0		Thick, strong string made of several strands that have been twisted together.	紐	रस्सी		绳子	ကြိုး		
2442	rotten:to.be	1728	ROTTEN	to be rotten	rotten	ʀᴏᴛᴛᴇɴ	2.0		Having changed its colour, smell or composition (partially or completely), due to being attacked and decomposed by microorganisms (relating to organic matter).	腐った	गला हुआ		腐烂的	ပုပ်ဖို့		
2443	rough:to.be	1923	ROUGH	to be rough	rough	ʀᴏᴜɢʜ	2.0		Having a texture that has much friction. Not smooth.	ざらざらな	रूखा		粗糙的	ကြမ်းတမ်းသည်		
2444	round:to.be	1395	ROUND	to be round	round	ʀᴏᴜɴᴅ	2.0		Circular or having a circular cross-section in at least one direction.	丸い	गोल		圆形的	ပတ်ပတ်လည်		
2446	rub:to	1449	RUB	to rub	rub	ʀᴜʙ	2.0		To move one's hand or an object over a surface or other object (maintaining constant contact and applying moderate pressure).	こする	रगड़ना		擦	ပွတ်ရန်		
2451	rule..lead:to	43	LEAD (GUIDE)	to rule (lead)	rule	ʀᴜʟᴇ	3.0		To guide by moving in front.		सीसा		铅	ခဲ ( Plumbum )		
2453	ruler..chief	–	–	ruler (chief)	ruler	ʀᴜʟᴇʀ	2.0		The person who has the highest authority in a group or organization.		मुखिया		首领	အကြီးအကဲ သို့မဟုတ် အုပ်ချုပ်သူ		CONCEPTICON has the measuring tool as the definition.
2459	sacred:to.be	–	–	to be sacred	sacred	ꜱᴀᴄʀᴇᴅ	4.0		To be regarded as holy or worthy of respect and devotion.		पवित्र		神圣的	မြင့်မြတ်ဖို့၊		
2461	sad:to.be	699	SAD	to be sad	sad	ꜱᴀᴅ	4.0		Feeling mentally uncomfortable because something is missing or wrong.	悲しい	उदास		悲伤的	ဝမ်းနည်းစရာ		
2462	sago.palm	2372	SAGO PALM	sago palm	sago.palm	ꜱᴀɢᴏ.ᴘᴀʟᴍ	4.0	flora	Common name for several plants which are used to produce a starchy food known as sago. // Predates rice as the staple food among some communities in western Arunachal Pradesh.							
2466	saliva	1503	SALIVA	saliva	saliva	ꜱᴀʟɪᴠᴀ	2.0	body parts	The clear liquid that is secreted by glands in the mouth and is used to moisten food and aid in digestion.		लार		口水	တံတွေး		
2467	salt	1274	SALT	salt	salt	ꜱᴀʟᴛ	1.0		A crystalline substance consisting of sodium and chlorine, used for seasoning or preserving food, or for a variety of other industrial and household purposes.	塩	नमक		盐	ဆားငန်		
2469	same:to.be	200	SAME	to be same	same	ꜱᴀᴍᴇ	4.0		Bearing full likeness by having precisely the same set of characteristics.		एक जैसा होना		相同的	အတူတူဖြစ်ရမယ်။		
2470	sand	671	SAND	sand	sand	ꜱᴀɴᴅ	4.0		A loose material consisting of small mineral particles, or rock and mineral particles, distinguishable by the naked eye; grains vary from almost spherical to angular, with a diameter range from 1/16 to 2 millimeters.	砂	रेत		沙子	သဲ		
2472	sap:tree	345	SAP	tree sap	tree.sap	ᴛʀᴇᴇ.ꜱᴀᴘ	4.0		The juice of plants of any kind, especially the ascending and descending juices or circulating fluid essential to nutrition.							
2482	scab	2664	SCAB	scab	scab	ꜱᴄᴀʙ	4.0		A bit of dried blood over a wound as part of the healing healing process.	かさぶた						
2488	scent..fragrance	–	–	scent (fragrance)	scent	ꜱᴄᴇɴᴛ	4.0		A distinctive smell or aroma that can be detected by the nose.	におい	सुगन्ध		香味	ရနံ့		
2495	scrape..with.edge:to	1767	SCRAPE	to scrape (with edge)	scrape	ꜱᴄʀᴀᴘᴇ	2.0		To move an object against another object such that abrasion or minor cutting occurs.		खुरचना		抓 / 刮	ခြစ်ရန် သို့မဟုတ် ခြစ်ရန်		
2498	scratch..with.nails:to	1436	SCRATCH	to scratch (with nails)	scratch	ꜱᴄʀᴀᴛᴄʜ	2.0		To rub or scrape (a part of the body) with a sharp object (e.g. to relieve an itching).	掻く	अनाज		稻	မကြေသေးသော ဆန်၊		
2501	scythe	20	SCYTHE	scythe	scythe	ꜱᴄʏᴛʜᴇ	4.0		A farm tool consisting of a long bent blade attached to a shaft, that is designed for cutting straws of grass or grain from an upright position.		कुर्पा		镰刀	တံမြက်/တံစဉ်		
2502	sea	1474	SEA	sea	sea	ꜱᴇᴀ	4.0		A body of salt water that is smaller than an ocean and generally in proximity to a continent.	海	समुद्र		海洋	သမုဒ္ဒရာ၊ ပင်လယ်		
2506	season:dry	452	DRY SEASON	dry season	dry.season	ᴅʀʏ.ꜱᴇᴀꜱᴏɴ	4.0		Yearly period of low rainfall in the tropics.		चावल का छिलका		稻壳	စပါးခွံ		
2507	season..monsoon:rainy	453	RAINY SEASON	rainy season (monsoon)	rainy.season	ʀᴀɪɴʏ.ꜱᴇᴀꜱᴏɴ	4.0		Period of year when most of a region's average annual rainfall occurs.	雨季	वर्षा ऋतु		雨季	မိုးရာသီ		
2509	secluded.place	–	–	secluded place	secluded.place	ꜱᴇᴄʟᴜᴅᴇᴅ.ᴘʟᴀᴄᴇ	4.0		A private or isolated place away from others.		रहस्यमय स्थान		隐蔽处	သီးသန့်နေရာ		
2511	section..segment	–	–	section (segment)	section	ꜱᴇᴄᴛɪᴏɴ	4.0		A segment or part of a larger whole.		खंड		竿节	အပိုင်း (ဥပမာ ဝါး)၊		
2512	see:to	1409	SEE	to see	see	ꜱᴇᴇ	2.0		To perceive with the eyes, or to comprehend mentally through observation or understanding.	見る	देखना		看	ကြည့်ရန်		
2513	seed	714	SEED	seed	seed	ꜱᴇᴇᴅ	1.0	flora	A mature fertilized plant ovule, consisting of an embryo and its food store surrounded by a protective seed coat (testa).	種	बीज		种子	မျိုးစေ့		
2519	sell:to	1571	SELL	to sell	sell	ꜱᴇʟʟ	2.0		To provide goods or services in exchange for money.	売る	बेचना		卖	ရောင်းရန်		
2526	separate:to	1359	SEPARATE	to separate	separate	ꜱᴇᴘᴀʀᴀᴛᴇ	4.0		To cause something or someone to move away from something or someone else.		अलग करना		分离	ခွဲခြားရန်		
2527	servant	255	SERVANT	servant	servant	ꜱᴇʀᴠᴀɴᴛ	4.0		A person performing duties for others. For example a person employed in a household which cares about the domestic duties.							
2532	settle..somwhere:to	–	–	to settle (somwhere)	settle	ꜱᴇᴛᴛʟᴇ	4.0		To establish oneself in a new location and make it one's permanent home.		निवास करना		定居	တစ်နေရာရာမှာ အခြေချဖို့		
2533	sew:to	1457	SEW	to sew	sew	ꜱᴇᴡ	2.0		To pass thread repeatedly through fabric or a material, using a needle, in order to join two or more parts or to make a pattern or motif.	縫う	सीवना		缝 / 裁缝	ချုပ်ရန်		
2535	shade..area	1388	SHADE	shade (area)	shade	ꜱʜᴀᴅᴇ	2.0		An area sheltered from direct sunlight, typically created by trees or other vegetation.		छाया		阴凉处	အရိပ်		
2536	shadow..of.something	2275	SHADOW	shadow (of something)	shadow	ꜱʜᴀᴅᴏᴡ	2.0		Darkness, where light (particularly sunlight) is blocked.	影	अचार		生米	မကျက်သောဆန်		
2539	shallow:to.be	193	SHALLOW	to be shallow	shallow	ꜱʜᴀʟʟᴏᴡ	3.0		Having little depth, or being close to the surface of something.	浅い	कम गहराई वाला		浅的	တိမ်		
2542	sharp..of.edge:to.be	1396	SHARP	to be sharp (of edge)	sharp	ꜱʜᴀʀᴘ	2.0		Having a thin or narrow edge capable of cutting or slicing.	鋭い	तेज़		尖锐的边缘	အစွန်းတစ်ခု၏ချွန်ထက်		
2543	sharp..of.point:to.be	–	–	to be sharp (of point)	sharp	ꜱʜᴀʀᴘ	2.0		Having a fine point or edge that is able to cut or pierce.		तीखा		尖锐的	ထက်မြက်သောအချက်၊		
2544	sharpen..edge:to			to sharpen (edge)	sharpen	ꜱʜᴀʀᴘᴇɴ	3.0									
2547	shave..head:to	231	SHAVE	to shave (head)	shave	ꜱʜᴀᴠᴇ	4.0		To remove hair from the skin by cutting it with a razor or other bladed implement.		बाल बन्द करना		刮胡子	ရိတ်ရန်		
2548	shawl	2771	SHAWL	shawl	shawl	ꜱʜᴀᴡʟ	4.0		A rectangular piece of fabric worn over the shoulders or head, typically worn by men in Nagaland.		शॉल		披肩	တစ်ဦးထည်း		
2549	sheep	1331	SHEEP	sheep	sheep	ꜱʜᴇᴇᴘ	4.0	fauna	A common, four-legged animal (Ovis) that is commonly kept by humans for its wool.	羊	भेड़		羊	သိုး		
2556	shield	1064	SHIELD	shield	shield	ꜱʜɪᴇʟᴅ	2.0		A device used to protect oneself or others from harm or danger when engaging in close combat. Typically woven from cane, carved from wood, or formed from toughened animal hide.		ढाल		盾牌	ဒိုင်း		
2557	shine..of.sun:to	708	SHINE	to shine (of sun)	shine	ꜱʜɪɴᴇ	4.0		To emit light.		चमकना		发光	တောက်ပဖို့		
2558	shiver:to	52	SHIVER	to shiver	shiver	ꜱʜɪᴠᴇʀ	4.0		To shake or tremble due to cold, fear, or excitement. To tremble.		काँपना		发抖	တုန်လှုပ်ခြင်း။		
2561	shoot..arrow:to	1172	SHOOT	to shoot (arrow)	shoot	ꜱʜᴏᴏᴛ	1.0		To fire a shot from a firearm, bow or other weapon.	撃つ	गोली चलाना		射击	ပစ်ရန်		
2566	short..duration:to.be	3312	SHORT (TIME)	to be short (duration)	short	ꜱʜᴏʀᴛ	4.0		For a brief period or a short amount of time.							
2567	short..height:to.be	1645	SHORT	to be short (height)	short	ꜱʜᴏʀᴛ	2.0		Small in length by comparison.		छोटा होना		矮	လူတို		
2568	short..length:to.be	1645	SHORT	to be short (length)	short	ꜱʜᴏʀᴛ	1.0		Small in length by comparison.	短い	छोटा होना		短	အတိုအရှည်ဖြစ်ရမည်။		
2571	show..display:to	1039	SHOW	to show (display)	show	ꜱʜᴏᴡ	4.0		To make something visible to others.	見せる	दिखाना		展示	ပြသရန်		
2573	shrimp:.prawn	2349	SHRIMP	shrimp	shrimp	ꜱʜʀɪᴍᴘ	4.0	fauna	Refers to some decapod crustaceans, although the exact animals covered can vary. Used broadly, it may cover any of the groups with elongated bodies and a primarily swimming mode of locomotion – chiefly Caridea and Dendrobranchiata.	蝦	झींगा		虾	ပုစွန်		
2575	shy:to.be	487	SHY	to be shy	shy	ꜱʜʏ	2.0		To be hesitant or reserved in social situations, often due to timidity or lack of confidence. This is distinct from ashamed.		शर्मीला होना		害羞	ရှက်ဖို့ကောင်းတယ်။		
2576	sibling:younger			younger sibling	younger.sibling	ʏᴏᴜɴɢᴇʀ.ꜱɪʙʟɪɴɢ	2.0		Either sibling which is younger							
2580	side..of.body	–	–	side (of body)	side	ꜱɪᴅᴇ	4.0	body parts	One of the two sides of the human or animal body, left or right, from the shoulder to the hip.		पार्श्व		侧面	ခန္ဓာကိုယ်၏အခြမ်း		
2581	side..of.something	682	SIDE	side (of something)	side	ꜱɪᴅᴇ	4.0		The surface that is not the front or back of an object.		किनारा		侧面	တစ်စုံတစ်ခု၏ဘက်		
2586	silver	759	SILVER	silver	silver	ꜱɪʟᴠᴇʀ	2.0		A very ductile malleable brilliant greyish-white element with symbol Ar and atomic number 47 having the highest electrical and thermal conductivity of any metal.	銀	चाँदी		银	ငွေ		
2587	similar:to.be	1558	SIMILAR	to be similar	similar	ꜱɪᴍɪʟᴀʀ	4.0		Having some particular qualities or characteristics in common, but not all of them.		समान होना		相似	အလားတူဖြစ်ရန်		
2590	sing:to	1261	SING	to sing	sing	ꜱɪɴɢ	2.0		To produce musical sounds with one's voice, often in a rhythmic or melodic pattern.	歌う	गाना गाना		唱歌	သီချင်းသီဆိုရန်		
2592	sink:to	1088	SINK (DESCEND)	to sink	sink	ꜱɪɴᴋ	2.0		To go down in water, mud, quicksand etc. or to cause something to go down in it.	沈む	डूबना		下沉	နစ်မြုပ်ရန်		
2593	sister:elder	1758	OLDER SISTER	elder sister	elder.sister	ᴇʟᴅᴇʀ.ꜱɪꜱᴛᴇʀ	2.0	kinship	The female sibling who is older than oneself.	姉	दीदी		姐姐	အစ်မ		
2595	sister:younger	1761	YOUNGER SISTER	younger sister	younger.sister	ʏᴏᴜɴɢᴇʀ.ꜱɪꜱᴛᴇʀ	4.0	kinship	The female sibling who is younger than oneself.	妹	छोटी बहन		妹妹	ညီမအငယ်		
2599	sit:to	1416	SIT	to sit	sit	ꜱɪᴛ	1.0		To be in a position with the upper body upright and the legs resting.	座る	बैठना		坐	ထိုင်ရန်		
2602	skilled:to.be	807	SKILLED	to be skilled	skilled	ꜱᴋɪʟʟᴇᴅ	4.0		To possess a high level of ability or proficiency in a particular task or activity.		कुशल होना		擅长	တစ်ခုခုကို ကျွမ်းကျင်ဖို့၊		
2603	skin	763	SKIN	skin	skin	ꜱᴋɪɴ	1.0	body parts	The tissue forming the outer covering of the vertebrate body: it consists of two layers, the outermost of which may be covered with hair, scales, feathers, etc. It is mainly protective and sensory in function.	皮膚	त्वचा		皮肤	အရေပြား		
2608	skirt..mekhela	1600	SKIRT	skirt (mekhela)	skirt	ꜱᴋɪʀᴛ	4.0		An article of clothing, usually worn by women and girls, that hangs from the waist and covers the lower part of the body. // This should be specified as that worn by women, the mekhela, and not that of men, a loungyi.							
2609	skull	1605	SKULL	skull	skull	ꜱᴋᴜʟʟ	4.0	body parts	The main bone of the head; the cranium.		खोपड़ी		颅骨	ဦးခေါင်းခွံ		
2610	sky	1732	SKY	sky	sky	ꜱᴋʏ	2.0		The part of the earth's atmosphere and space outside it that is visible from earth's surface. During the day it is perceived as blue, and at night as black.	空	आकाश		天空	ကောင်းကင်		
2616	sleep:to	1585	SLEEP	to sleep	sleep	ꜱʟᴇᴇᴘ	1.0		To rest in a state of decreased consciousness and reduced metabolism.	眠る	सोना		睡觉	အိပ်ရန်		
2624	slippery:to.be	3702	SLIPPERY	to be slippery	slippery	ꜱʟɪᴘᴘᴇʀʏ	4.0		Smooth or wet so that it is difficult to hold or stand on it.		चिकना		滑	ချောရမည်။		
2626	slow:to.be	701	SLOW	to be slow	slow	ꜱʟᴏᴡ	2.0		With low speed.	ゆっくりと, おそい	धीमा		慢	နှေးနှေး		
2629	small:to.be	1246	SMALL	to be small	small	ꜱᴍᴀʟʟ	2.0		Having a small size or dimensions, often relative to others of its kind.	小さい	छोटा होना		小	သေးငယ်ဖို့		
2632	smell..vi:to	1587	SMELL (STINK)	to smell (vi)	smell	ꜱᴍᴇʟʟ	4.0		To give off a smell that can be perceived by the nose.		खुशबू होना		有味道	အနံ့ရှိရန်		
2633	smell..vt:to	1586	SMELL (PERCEIVE)	to smell (vt)	smell	ꜱᴍᴇʟʟ	2.0		To perceive the presence of molecules in the air by inhaling them through the nose.	嗅ぐ, におう	सूंघना		闻	အနံ့ခံရန်		
2634	smell.bad:to	–	–	to smell bad	smell.bad	ꜱᴍᴇʟʟ.ʙᴀᴅ	3.0		To emit an unpleasant odor or stench.				臭	အနံ့ဆိုးဖို့		
2635	smell.good..fragrant:to	–	–	to smell good (fragrant)	smell.good	ꜱᴍᴇʟʟ.ɢᴏᴏᴅ	3.0		To emit a pleasant or desirable odor or fragrance.		सुगंधित होना		香	အနံ့ကောင်းဖို့		
2636	smile:to	1451	SMILE	to smile	smile	ꜱᴍɪʟᴇ	4.0		To make an upwards movement of the sides of the mouth, that indicates happiness or satisfaction.		मुस्कुराना		微笑	ပြုံးဖို့		
2637	smoke	778	SMOKE (EXHAUST)	smoke	smoke	ꜱᴍᴏᴋᴇ	1.0		An aerosol, consisting of visible particles and gases, produced by the incomplete burning of carbon-based materials, such as wood and fossil fuels.	煙	धुआं		烟	မီးခိုး		
2638	smoke:to	1689	SMOKE (INHALE)	to smoke	smoke	ꜱᴍᴏᴋᴇ	2.0		To inhale smoke from for example a cigarette or a cigar.		धूम्रपान करना		抽烟	ဆေးလိပ်သောက်ရန်		
2640	smooth:to.be	1234	SMOOTH	to be smooth	smooth	ꜱᴍᴏᴏᴛʜ	2.0		Not rough; having a surface texture that lacks friction.	すべすべした	मुलायम होना		平滑	ချောမွေ့စေရန်		
2642	snail	1543	SNAIL	snail	snail	ꜱɴᴀɪʟ	2.0	fauna	(Gastropoda) Ventral footed mollusk, including land snails, terrestrial pulmonate gastropod mollusks.	カタツムリ	घोंघा		蜗牛	ခရု		
2644	snake	730	SNAKE	snake	snake	ꜱɴᴀᴋᴇ	1.0	fauna	Any reptile of the suborder Serpentes, typically having a scaly cylindrical limbless body, fused eyelids, and a jaw modified for swallowing large prey.	蛇	साँप		蛇	မြွေ		
2645	sneeze:to	1621	SNEEZE	to sneeze	sneeze	ꜱɴᴇᴇᴢᴇ	4.0		To expel air rapidly as a reflex, usually induced by an irritation in the nose.		छींकना		打喷嚏	နှာချေရန်		
2646	snore:to	1983	SNORE	to snore	snore	ꜱɴᴏʀᴇ	4.0		To make a noise during sleep by vibration of soft respiratory tissues (soft palate, base of the tongue and pharyngeal walls), particularly during inhalation.		खर्राटे लेना		打鼾	ဟောက်ရန်		
2648	snot..solid.mucus	208	NASAL MUCUS (SNOT)	snot (solid mucus)	snot	ꜱɴᴏᴛ	2.0	body parts	Mucus from the nose.	鼻糞	नाक का मूसा		鼻涕	နှပ်		
2655	soft:to.be	1856	SOFT	to be soft	soft	ꜱᴏꜰᴛ	2.0		A state of consistency allowing alterations of form with ease, no big force required, to bring things into something of this state (such as e.g. soaked loam or clay soil).	やわらかい	मुलायम होना		软	ပျော့ပျောင်းစေရန်		
2659	some..portion	1241	SOME	some (portion)	some	ꜱᴏᴍᴇ	4.0		An unspecified quantity or number of.	いくつか	कुछ  नहीं सब		一些	အချို့၊ အားလုံးမဟုတ်ပါ။		
2663	son	1620	SON	son	son	ꜱᴏɴ	3.0	kinship	One's male child.	息子	बेटा		儿子	သား		
2664	son.in.law	1056	SON-IN-LAW	son in law	son.in.law	ꜱᴏɴ.ɪɴ.ʟᴀᴡ	4.0	kinship	The male marital partner of someone's child.	婿	जमाई		女婿	သမက်		
2665	song	1096	SONG	song	song	ꜱᴏɴɢ	4.0		A musical piece with lyrics (or words to sing); prose that one can sing.	歌	गीत		歌曲	သီချင်း		
2668	soul!spirit..of.living	811	SOUL	soul, spirit (of living)	soul	ꜱᴏᴜʟ	4.0		In philosophical or religious belief the immaterial part of a human being.		आत्मा		灵魂	ဝိညာဉ်		
2670	sour:to.be	1906	SOUR	to be sour	sour	ꜱᴏᴜʀ	2.0		Having an acid, sharp or tangy taste.	すっぱい	खट्टा होना		酸	အချဉ်ဖြစ်ရန်		
2672	south	1595	SOUTH	south	south	ꜱᴏᴜᴛʜ	4.0		One of the four major compass points, specifically 180°, directed toward the South Pole, and conventionally downwards on a map.	南	दक्षिण		南	တောင်		
2673	sow..crops:to	748	SOW SEEDS	to sow (crops)	sow	ꜱᴏᴡ	2.0		To scatter or disperse seeds on a field.	蒔く	बोना या बोवाई करना		播种	ကြဲရန်		
2675	soy.bean	2028	SOYA BEAN	soy bean	soy.bean	ꜱᴏʏ.ʙᴇᴀɴ	4.0	flora	The edible seed of the soybean plant which contains a lot of protein.		सोयाबीन		黄豆	ပဲပိစပ်		
2681	sparrow	1854	SPARROW	sparrow	sparrow	ꜱᴘᴀʀʀᴏᴡ	4.0	fauna	A small song bird, in the family Passeridae.	雀	गौरैया		麻雀	စာငှက်		
2683	speak:to	1623	SPEAK	to speak	speak	ꜱᴘᴇᴀᴋ	2.0		To communicate by the use of words.	話す	बोलना		说	ပြောရန် သို့မဟုတ် ပြောရန်		
2684	spear	945	SPEAR	spear	spear	ꜱᴘᴇᴀʀ	1.0		a long, stabbing weapon for thrusting or throwing, consisting of a wooden shaft to which a sharp-pointed head, as of iron or steel, is attached.	槍	भाला		矛	လှံ		
2685	special:to.be	–	–	to be special	special	ꜱᴘᴇᴄɪᴀʟ	4.0		To be unique or different from what is ordinary or usual.		विशेष होना		特别	အထူးဖြစ်ရန်		
2689	spicy..of.chilis	544	SPICY	spicy (of chilis)	spicy	ꜱᴘɪᴄʏ	3.0		Provoking a burning sensation due to the presence of chillies or similar hot spices.	苦い	मसालेदार		辣	ငရုတ်သီးမှအစပ်		
2690	spider	843	SPIDER	spider	spider	ꜱᴘɪᴅᴇʀ	2.0	fauna	Any predatory silk-producing arachnid of the order Araneae, having four pairs of legs and a rounded unsegmented body consisting of abdomen and cephalothorax.	蜘蛛	मकड़ी		蜘蛛	ပင့်ကူ		
2691	spider::web	1065	SPIDER WEB	spiderweb	spiderweb	ꜱᴘɪᴅᴇʀᴡᴇʙ	2.0	fauna	A fine net of threads woven by a spider to catch insects.		मकड़ी का जाल		蜘蛛网	ပင့်ကူအိမ်ကွန်ယက်		
2693	spin..cotton:to	–	–	to spin (cotton)	spin	ꜱᴘɪɴ	4.0		To twist or spin fibers of cotton into thread or yarn.	紡ぐ	धुनाई करना		纺	ချည်လှည့်ဖို့		
2694	spirit..deity	53	SPIRIT	spirit (deity)	spirit	ꜱᴘɪʀɪᴛ	4.0		A spiritual entity that is not as powerful as a deity.	神	आत्मा		精神	စိတ်ဝိညာဉ်		
2696	spit:to	1440	SPIT	to spit	spit	ꜱᴘɪᴛ	2.0		To forcefully evacuate saliva from the mouth.	つばを吐く	थूकना		吐	တံတွေးထွေးရန်		
2700	splinter..injury	–	–	splinter (injury)	splinter	ꜱᴘʟɪɴᴛᴇʀ	4.0		A small sharp piece of wood which is stuck in the skin.							
2701	split:to	1437	SPLIT	to split	split	ꜱᴘʟɪᴛ	4.0		To divide fully or partly along a more or less straight line.		फटना		劈	ခွဲရန်		
2704	spoil..of.food:to	569	SPOIL (BECOME SPOILED)	to spoil (of food)	spoil	ꜱᴘᴏɪʟ	4.0		Of food, to become bad, sour or rancid; to decay.		ख़राब होना		腐败	လုယူရန်		
2706	spoon..utensil	1378	SPOON	spoon (utensil)	spoon	ꜱᴘᴏᴏɴ	4.0		An implement for eating or serving, a small bowl with a long straight handle.	匙	चम्मच		勺子	ဇွန်း		
2711	spread..of.roots:to	38	SPREAD OUT	to spread (of roots)	spread	ꜱᴘʀᴇᴀᴅ	4.0		To spread out or open from a closed or folded state.		फैलना		扩散	အမြစ်၏ပြန့်ပွားရန်		
2722	squeeze:to	1414	SQUEEZE	to squeeze	squeeze	ꜱꞯᴜᴇᴇᴢᴇ	2.0		To apply pressure to something from two or more sides at once.	しぼる	दबाना		挤	ညှစ်ရန်		
2723	squirrel:flying	3271	FLYING SQUIRREL	flying squirrel	flying.squirrel	ꜰʟʏɪɴɢ.ꜱꞯᴜɪʀʀᴇʟ	4.0	fauna	A squirrel of the sub-family Pteromyinae of the family Sciuridae.		उड़ती गिलहरी		飞鼠	ရှဉ့်ပျံ		
2724	squirrel..general	1628	SQUIRREL	squirrel (general)	squirrel	ꜱꞯᴜɪʀʀᴇʟ	4.0	fauna	A small or medium-sized rodent of the family Sciuridae.	リス	गिलहरी		松鼠	ရှဉ့်		
2730	stand..remain.standing:to	1442	STAND	to stand (remain standing)	stand	ꜱᴛᴀɴᴅ	1.0		To assume an upright position on one's feet, often with the intention of remaining stationary for a period of time.	立つ	खड़े रहना		站	ရပ်တည်ရန်		
2732	star	1430	STAR	star	star	ꜱᴛᴀʀ	1.0		A luminous celestial body that is made from gases (particularly hydrogen and helium) and forms the shape of a sphere.	星	तारा		星星	ကြယ်ပွင့်		
2733	star:shooting	2835	SHOOTING STAR	shooting star	shooting.star	ꜱʜᴏᴏᴛɪɴɢ.ꜱᴛᴀʀ	4.0		Name for the visible path of a meteoroid.							
2736	stay:to	–	–	to stay	stay	ꜱᴛᴀʏ	4.0		To live or remain in a particular place or location for an extended period of time.		रहना		住	နေဖို့၊ နေဖို့		
2738	steal:to	713	STEAL	to steal	steal	ꜱᴛᴇᴀʟ	2.0		To take possession of property belonging to another without the consent of this owner; most typically when not observed, rather than by force.	盗む	चुराना		偷	ခိုးယူရန်		
2744	step:to	2065	STEP (VERB)	to step	step	ꜱᴛᴇᴘ	3.0		To move the foot in walking; to advance or recede by raising and moving one of the feet to another resting place, or by moving both feet in succession.		कदम रखना		迈步	ခြေတစ်လှမ်းယူရန်		
2745	step.on:to	–	–	to step on	step.on	ꜱᴛᴇᴘ.ᴏɴ	4.0		To place your foot on top of something, often accidentally or unintentionally.		कुछ पर कदम रखना		踩	တစ်ခုခုကို လှမ်းဖို့		
2746	stick..glue:to			to stick (glue)	stick	ꜱᴛɪᴄᴋ	3.0									
2747	stick..tree	1295	STICK	stick (tree)	stick	ꜱᴛɪᴄᴋ	2.0		A long, thin piece of wood, mainly left in the shape in which it grew, that does not bend.	杖, 棒	छड़ी		棍子	တုတ်		
