slno	concept_id	concepticon_id	concepticon_name	name	gloss	concept	stage	category	definition	japanese	hindi	assamese	mandarin	burmese	nagamese	comment
0	0000.:zero	1294	ZERO	zero	zero	ᴢᴇʀᴏ	4	numbers	The integer zero (0).	零	शून्य	শূন্য	零	သုည		
1	0001.:one	1493	ONE	one	one	ᴏɴᴇ	1	numbers	The default numeral for one (1). // It should not include a numeral classifier, but instead be only the bare numeral.	一	एक	এক	一	တစ်		
2	0002.:two	1498	TWO	two	two	ᴛᴡᴏ	1	numbers	The natural number two (2). // It should not include a numeral classifier, but instead be only the bare numeral.	二	दो	দুই	二	နှစ်		
3	0003.:three	492	THREE	three	three	ᴛʜʀᴇᴇ	1	numbers	The natural number three (3). // It should not include a numeral classifier, but instead be only the bare numeral.	三	तीन	তিনি	三	သုံး		
4	0004.:four	1500	FOUR	four	four	ꜰᴏᴜʀ	1	numbers	The default numeral for four (4). It should not include a numeral classifier, but instead be only the bare numeral.	四	चार	চাৰি	四	လေး		
5	0005.:five	493	FIVE	five	five	ꜰɪᴠᴇ	1	numbers	The default numeral for five (5). It should not include a numeral classifier, but instead be only the bare numeral.	五	पांच	পাঁচ	五	ငါး		
6	0006.:six	1703	SIX	six	six	ꜱɪx	1	numbers	The natural number six (6). // It should not include a numeral classifier, but instead be only the bare numeral.	六	छह	ছয়	六	ခြောက်ခဲ့သည်		
7	0007.:seven	1704	SEVEN	seven	seven	ꜱᴇᴠᴇɴ	1	numbers	The natural number seven (7). // It should not include a numeral classifier, but instead be only the bare numeral.	七	सात	সাত	七	ခုနှစ်		
8	0008.:eight	1705	EIGHT	eight	eight	ᴇɪɢʜᴛ	1	numbers	The natural number eight (8). // It should not include a numeral classifier, but instead be only the bare numeral.	八	आठ	আঠ	八	ရှစ်		
9	0009.:nine	1483	NINE	nine	nine	ɴɪɴᴇ	1	numbers	The default numeral for nine (9). It should not include a numeral classifier, but instead be only the bare numeral.	九	नौ	নৱ	九	ကိုး		
10	0010.:ten	1515	TEN	ten	ten	ᴛᴇɴ	0	numbers	The default numeral for ten (10). It should not include a numeral classifier, but instead be only the bare numeral.	十	दस	দহ	十	ဆယ်		
11	0011.:eleven	1706	ELEVEN	eleven	eleven	ᴇʟᴇᴠᴇɴ	4	numbers	The natural number eleven (11).							
12	0012.:twelve	1707	TWELVE	twelve	twelve	ᴛᴡᴇʟᴠᴇ	4	numbers	The natural number twelve (12).							
13	0013.:thirteen	1708	THIRTEEN	thirteen	thirteen	ᴛʜɪʀᴛᴇᴇɴ	4	numbers	The natural number thirteen (13).							
14	0014.:fourteen	2451	FOURTEEN	fourteen	fourteen	ꜰᴏᴜʀᴛᴇᴇɴ	4	numbers	The natural number fourteen (14).							
15	0015.:fifteen	1709	FIFTEEN	fifteen	fifteen	ꜰɪꜰᴛᴇᴇɴ	4	numbers	The natural number fifteen (15).							
16	0016.:sixteen	2454	SIXTEEN	sixteen	sixteen	ꜱɪxᴛᴇᴇɴ	4	numbers	The natural number sixteen (16).							
17	0017.:seventeen	2453	SEVENTEEN	seventeen	seventeen	ꜱᴇᴠᴇɴᴛᴇᴇɴ	4	numbers	The natural number seventeen (17).							
18	0018.:eighteen	1713	EIGHTEEN	eighteen	eighteen	ᴇɪɢʜᴛᴇᴇɴ	4	numbers	The natural number eighteen (18).							
19	0019.:nineteen	1714	NINETEEN	nineteen	nineteen	ɴɪɴᴇᴛᴇᴇɴ	4	numbers	The natural number nineteen (19).							
20	0020.:twenty	1710	TWENTY	twenty	twenty	ᴛᴡᴇɴᴛʏ	2	numbers	The natural number twenty (20).		बीस	বিশ	二十	ပိသျှတ်		
30	0030.:thirty	1715	THIRTY	thirty	thirty	ᴛʜɪʀᴛʏ	4	numbers	The natural number thirty (30).							
40	0040.:forty	1716	FORTY	forty	forty	ꜰᴏʀᴛʏ	4	numbers	The natural number forty (40).							
50	0050.:fifty	1717	FIFTY	fifty	fifty	ꜰɪꜰᴛʏ	4	numbers	The natural number fifty (50).							
100	0100.:hundred	1634	HUNDRED	hundred	hundred	ʜᴜɴᴅʀᴇᴅ	2	numbers	The natural number one hundred (100).		सौ	শত	百	ရာ		
200	0200.:two.hundred	2676	TWO HUNDRED	two hundred	two.hundred	ᴛᴡᴏ.ʜᴜɴᴅʀᴇᴅ	4	numbers	The natural number two hundred (200).							
300	0300.:three.hundred	3513	THREE HUNDRED	three hundred	three.hundred	ᴛʜʀᴇᴇ.ʜᴜɴᴅʀᴇᴅ	4	numbers	The natural number three hundred (300). // This is included in the concept list to determine composition of higher numbers.							
400	0400.:four.hundred	3515	FOUR HUNDRED	four hundred	four.hundred	ꜰᴏᴜʀ.ʜᴜɴᴅʀᴇᴅ	4	numbers	The natural number four hundred (400). // This is included in the concept list to determine composition of higher numbers.							
500	0500.:five.hundred	3516	FIVE HUNDRED	five hundred	five.hundred	ꜰɪᴠᴇ.ʜᴜɴᴅʀᴇᴅ	4	numbers	The natural number five hundred (500). // This is included in the concept list to determine composition of higher numbers.							
501	1.du	2634	WE TWO	1 du	1.du	1.ᴅᴜ	2	pronouns	The speaker and exactly one other person. // The first person dual pronominal stem. In varieties which have this stem, it is typically derived from a proposed etymon #tsi. Varieties which lack stem suppletion for dual pronominal forms should have their compounds recorded as such.							
502	1.du.excl	2636	WE TWO (EXCLUSIVE)	1 du excl	1.du.excl	1.ᴅᴜ.ᴇxᴄʟ	4	pronouns	Exclusive form of the dual pronominal stem. This should only be filled out for languages which have a suppletive clusivity distinction.							
503	1.du.incl	2637	WE TWO (INCLUSIVE)	1 du incl	1.du.incl	1.ᴅᴜ.ɪɴᴄʟ	4	pronouns	Inclusive form of the dual pronominal stem. This should only be filled out for languages which have a suppletive clusivity distinction.							
505	1.n.sg.excl	1130	WE (EXCLUSIVE)	1 n sg excl	1.n.sg.excl	1.ɴ.ꜱɢ.ᴇxᴄʟ	1	pronouns	Exclusive form of the non-singular and non-dual pronominal stem. This should only be filled out for languages which have a suppletive clusivity distinction.					ကျွန်တစ်ဦးတည်းနှင့်တကွ		
506	1.n.sg.incl	1131	WE (INCLUSIVE)	1 n sg incl	1.n.sg.incl	1.ɴ.ꜱɢ.ɪɴᴄʟ	1	pronouns	Inclusive form of the non-singular and non-dual pronominal stem. This should only be filled out for languages which have a suppletive clusivity distinction.					ကျွန်မှာတော့		
507	1.sg	1209	I	1 sg	1.sg	1.ꜱɢ	1	pronouns	The first-person singular pronominal stem, typically a reflex of PTB *ŋa or *ka.	わたし						
509	1000.:thousand	1843	THOUSAND	thousand	thousand	ᴛʜᴏᴜꜱᴀɴᴅ	2	numbers	The natural number one thousand (1000).		हजार	হাজাৰ	千	ထောင်		
512	2.n.sg	1213	YOU	2 n sg	2.n.sg	2.ɴ.ꜱɢ	1	pronouns	Second person non-singular pronominal stem. This will not likely have a suppletive dual counterpart.	おまえたち				သင့်တော်တို့		
513	2.sg	1215	THOU	2 sg	2.sg	2.ꜱɢ	1	pronouns	The second-person singular pronominal stem, typically but not always a reflex of *naŋ.	おまえ						
518	3.n.sg	817	THEY	3 n sg	3.n.sg	3.ɴ.ꜱɢ	1	pronouns	Third person non-singular pronominal stem, unmarked for gender. If gendered forms are attested they should be added under separate concepts.	彼ら，彼女ら				သူတို့		
519	3.sg	262	HE OR SHE OR IT	3 sg	3.sg	3.ꜱɢ	1	pronouns	Third person singular pronominal stem. This may in some cases also be one of the demonstrative stems, as is the case in much of Bodo-Garo.	彼，彼女						
526	above:to.be	1741	ABOVE	to be above	above	ᴀʙᴏᴠᴇ	2		Situated in a higher place than something else.		ऊपर	উপৰ	上面	အထက်		
530	accipitridae..raptor:::	2683	EAGLE OR HAWK	Accipitridae (raptor)	raptor	ʀᴀᴘᴛᴏʀ	2	fauna	A bird of prey with broad wings and a hooked bill. Kites are the most common which occur in the area. This should be the most general term for this class of birds, and not a compound term for a specific species. Any specific genera/species names should be noted separately.	鷹	चील		鹰	သိမ်းငှက်၊ လင်းယုန် သို့မဟုတ် စွန်ရဲ		
541	adolescent	–	–	adolescent	adolescent	ᴀᴅᴏʟᴇꜱᴄᴇɴᴛ	4		Telating to or characteristic of adolescence, typically between 13 and 19 years old. This may not be attested in all languages, but is may reflect the age range prior to being a full adult.		किशोरावस्था		青少年的	ဆယ်ကျော်သက်		
546	afraid:to.be			to be afraid	afraid	ᴀꜰʀᴀɪᴅ	4									
548	afternoon	1807	AFTERNOON	afternoon	afternoon	ᴀꜰᴛᴇʀɴᴏᴏɴ	3		The part of the day which follows noon, between noon and evening.		दोपहर	বিলাস	下午	နေ့လည်		
550	age..grow.old:to	–	–	to age (grow old)	age	ᴀɢᴇ	4		To age and become older.		बूढ़ा होना		变老	လူအို၊		
551	age..of.person	1789	AGE	age (of person)	age	ᴀɢᴇ	4		The length of time a person has been alive, usually measured in years.	年齢	उम्र	বয়স	年龄	လူတစ်ဦး၏အသက်		
552	age..of.thing			age (of thing)	age	ᴀɢᴇ	4									
557	alcohol:brewed	404	ALCOHOL (FERMENTED DRINK)	brewed alcohol	brewed.alcohol	ʙʀᴇᴡᴇᴅ.ᴀʟᴄᴏʜᴏʟ	1		A fermented drink is a beverage containing alcohol because of a metabolic process that converts sugar to acids, gases and/or alcohol (e.g. beer or wine).		सुराही दार शराब	জলকীয় দ্রব	酿造酒	အရက်ချက်		
558	alcohol:distilled	842	LIQUOR	distilled alcohol	distilled.alcohol	ᴅɪꜱᴛɪʟʟᴇᴅ.ᴀʟᴄᴏʜᴏʟ	2		Alcoholic beverages made through distillation, such as whiskey or vodka. This will often be a borrowing, either from Tai or IA, though some varieties will retain a native form.	酒	अर्क	মদ	蒸馏酒	ပေါင်းခံအရက်		
565	alive:to.be	1422	BE ALIVE	to be alive	alive	ᴀʟɪᴠᴇ	2		To have life and be living, not dead.	生きている	जीवित	জিৱন থাকিব	活着	အသက်ရှင်ဖို့		
566	all	98	ALL	all	all	ᴀʟʟ	4		The whole quantity or extent of something. Or, everyone or everything considered together.	全部	सब	সমগ্ৰ	所有	အားလုံး		
572	amber	–	–	amber	amber	ᴀᴍʙᴇʀ	3		A hard, translucent fossilized resin, typically yellowish-brown in color. Used in some communities for ornaments such as earrings.		अंबर	বাঁশফুলীয়া	琥珀	ပယင်း		
576	ancestors..general	1669	ANCESTORS	ancestors (general)	ancestors	ᴀɴᴄᴇꜱᴛᴏʀꜱ	4		The prople from whom one is descended, especially when more remote than a grandparent. This concept should be for figures which would not have been personally known by the speaker due to the distance in time.		पूर्वज	পূৰ্বজ	祖先	ဘိုးဘေး		
578	angry:to.be	1826	ANGRY	to be angry	angry	ᴀɴɢʀʏ	3		Feeling or showing strong annoyance, displeasure, or hostility, usually toward someone or some thing.	怒る	गुस्सा	ৰাগী	生气	စိတ်ဆိုး		
579	animal..affix:female	3923	FEMALE ANIMAL	female animal (affix)	female.animal	ꜰᴇᴍᴀʟᴇ.ᴀɴɪᴍᴀʟ	4		Of or denoting the sex that can bear offspring or produce eggs, distinguished biologically by the production of gametes (ova).		मादा		女性	အမျိုးသမီး		
580	animal..affix:male	3924	MALE ANIMAL	male animal (affix)	male.animal	ᴍᴀʟᴇ.ᴀɴɪᴍᴀʟ	4		The marker used for animals which marks them as male.							
581	animal..general	619	ANIMAL	animal (general)	animal	ᴀɴɪᴍᴀʟ	2	fauna	Any living organism characterized by voluntary movement, the possession of cells with noncellulose cell walls and specialized sense organs enabling rapid response to stimuli, and the ingestion of complex organic substances such as plants and other animals.	動物	जानवर	পশু	动物	တိရစ္ဆာန်		
588	answer.:respond:to	1275	ANSWER	to respond	respond	ʀᴇꜱᴘᴏɴᴅ	4		To communicate in response to something.	答える						
589	answer..question:to	1275	ANSWER	to answer (question)	answer	ᴀɴꜱᴡᴇʀ	4		To communicate a message of any form in reaction to something that has been asked or expressed, to the being who expressed it; to react verbally.	答える	जवाब देना	উত্তৰ দিব	回答	အဖြေ၊ တုံ့ပြန်		
590	ant::hill	1873	ANTHILL	anthill	anthill	ᴀɴᴛʜɪʟʟ	4		A mound of earth made by ants as they dig their nest.		चींटी का ढेर	হুঁটুলঘৰ	蚁丘	ပုရွက်ဆိတ်ကုန်း		
595	ant.:termite	883	TERMITE	termite	termite	ᴛᴇʀᴍɪᴛᴇ	2	fauna	A soft-bodied insect of the order Isoptera; individuals feed on cellulose and live in colonies with a caste system comprising three types of functional individuals: sterile workers and soldiers, and the reproductives.		दीमक	হুঁটুল	白蚁	ခြကောင်		
596	ant..general	587	ANT	ant (general)	ant	ᴀɴᴛ	1		Any of the black, red, brown, or yellow insects of the family Formicidae characterized by a large head and by living in organized colonies.	蟻	चींटी	পিঁপিলিকা	蚂蚁	ပုရွက်ဆိတ်		
602	anxious:to.be	3869	ANXIOUS	to be anxious	anxious	ᴀɴxɪᴏᴜꜱ	4		Having the feeling of anxiety. To feel worried, uneasy, or nervous about something. Distinct from eagerness.	心配する	चिंतित होना	উদাসীন থাকিব	焦虑	စိတ်စောဖို့၊ ပေါ်လာဖို့		
603	apologise:to	–	–	to apologise	apologise	ᴀᴘᴏʟᴏɢɪꜱᴇ	4		To express regret, remorse, sadness or accountability regarding something that one has done or failed to do.		माफ़ करना		对不起	စိတ်မကောင်းဖြစ်ရတယ်။		
604	appear:to	–	–	to appear	appear	ᴀᴘᴘᴇᴀʀ	4		To come into sight or become visible from being previously invisible or absent.		दिखाई देना	দৃষ্টা পোৱা	出现	ပေါ်လာဖို့		
610	area.under.house	2632	AREA UNDER HOUSE	area under house	area.under.house	ᴀʀᴇᴀ.ᴜɴᴅᴇʀ.ʜᴏᴜꜱᴇ	4		The large space below a traditional stilt house, used for storage, keeping animals or building looms.					အုတ်တံတိုင်းအိမ်အောက် ဧရိယာ		
611	areca.nut	217	BETELNUT	areca nut	areca.nut	ᴀʀᴇᴄᴀ.ɴᴜᴛ	4	flora	The fruit of the areca palm, often chewed with betel leaf and other ingredients in many parts of Asia for its stimulant effects. Ofte called betel nut, but not coming from the same plant as the betel leaf.	キンマ	सुपारी	তামুল	槟榔	ကွမ်းသီး၊		Concepticon has both BETEL NUTE and BETELNUT. This is marked as absent in Concepticon since betel is a different species, and the inconsistent labels in Concepticon create ambiguity.
616	arm::pit	1886	ARMPIT	armpit	armpit	ᴀʀᴍᴘɪᴛ	3	body parts	The hollow beneath the junction of the arm and shoulder.	わきの下	बगल	কখেলা	腋窝	ချိုင်း		
617	arm:upper	431	UPPER ARM	upper arm	upper.arm	ᴜᴘᴘᴇʀ.ᴀʀᴍ	4	body parts	The part of the arm between the shoulder and the elbow. This concept may not be present in many language varieties.		बांह की ऊपरी हिस्सा	ভুজা	上臂	လက်မောင်းအပေါ်ပိုင်း		
618	arm.:elbow	981	ELBOW	elbow	elbow	ᴇʟʙᴏᴡ	3	body parts	The joint between the forearm and the upper arm.	ひじ	कोहनी	কুহুনি	肘部	တံတောင်ဆစ်		
619	arm.:elbow:inner	–	–	inner elbow	inner.elbow	ɪɴɴᴇʀ.ᴇʟʙᴏᴡ	4	body parts	The inner part of the elbow where the arm bends.		कोहनी का अंदरूंग		肘窝	အတွင်းတံတောင်ဆစ်		
621	arm.:forearm	–	–	forearm	forearm	ꜰᴏʀᴇᴀʀᴍ	4	body parts	The part of the arm between the elbow and the wrist. This concept may not be present in many language varieties.		कलाई	কলাই	前臂	လက်ဖျံ		
622	arm.:shoulder	1482	SHOULDER	shoulder	shoulder	ꜱʜᴏᴜʟᴅᴇʀ	3	body parts	The joint connecting the upper arm and the torso, especially the top or outermost part.	肩	कंधा		肩膀	ပခုံး		
626	arm.:wrist	799	WRIST	wrist	wrist	ᴡʀɪꜱᴛ	3	body parts	The joint connecting the hand and the forearm. This will typically be a compund involving the general hand/arm stem, and is likely to be entirely distinct from the term for elbow.	手首	कलाई का जोड़ा	কলাই	手腕	လက်ကောက်ဝတ်		
628	arm..general	1673	ARM	arm (general)	arm	ᴀʀᴍ	2	body parts	One of the two upper extremeties of the human body, extending from the shoulder to the wrist. This should be the most general term, and will often include the hand as well. A term for arm which does not include the hand is not expected.	腕	बांह	বাঁহ		လက်		
631	arrive:to	1387	ARRIVE	to arrive	arrive	ᴀʀʀɪᴠᴇ	4		To come to a destination.	着く	पहुंचना	আহা	到达	ရောက်ရှိရန်		
632	arrow	977	ARROW	arrow	arrow	ᴀʀʀᴏᴡ	2		Pointed projectile that is shot with a bow.	矢	तीर	বাণ	箭头	မြှား		
635	ascend..move.up:to	705	GO UP (ASCEND)	to ascend (move up)	ascend	ᴀꜱᴄᴇɴᴅ	2		To move from a lower to a higher position by climbing. This should be distinct from the general go verbs which exist as part of systems of topographical deixis.	のぼる	चढ़ना		爬	တက်ရန် သို့မဟုတ် တက်ရန်		
636	ash	646	ASH	ash	ash	ᴀꜱʜ	1		The powdery incombustible residue left after the burning of a substance. Additional terms for different types of ash may be present, such as the stringy ash left over from burning dry bamboo. This concept is only for the most basic powdery type, but other forms should be documented as such.	灰	राख	বলি	灰烬	ပြာ		
637	ash..bamboo	–	–	ash (bamboo)	ash	ᴀꜱʜ	4		The stringy type of ash which is characteristic of burning dried bamboo.							
638	ashamed:to.be	1894	ASHAMED	to be ashamed	ashamed	ᴀꜱʜᴀᴍᴇᴅ	2		Feeling shame or guilt. This is distinct from being shy.	恥じる						
639	ask..question:to	1309	ASK (INQUIRE)	to ask (question)	ask	ᴀꜱᴋ	4		To inquire about something or express a desire or need for information about something. This is distinct from requesting action or requesting an item from someone.	黙る	पूछना	জানাইছো	请求	တောင်းဆိုရန် သို့မဟုတ် တောင်းဆိုရန်		
654	awaken:to	1602	WAKE UP	to awaken	awaken	ᴀᴡᴀᴋᴇɴ	2		To stop sleeping and become conscious, to stir or come into awareness.	目覚める	जागना	জাগা	醒来	နိုးထရန်		
655	axe..general	677	AXE	axe (general)	axe	ᴀxᴇ	3		A tool for felling trees or chopping wood consisting of a heavy metallic or stone head flattened to a blade on one side, and which is attached to a usually wooden handle.	斧	कुल्हाड़ी	ফাঁস	斧头	ပုဆိန်		
656	back..of.body	1291	BACK	back (of body)	back	ʙᴀᴄᴋ	3	body parts	The rear surface of the human body from the shoulders to the hips.	背中	पीठ	পিছলৈ	背部	လူသားကဲ့သို့ ကျော၊		
657	back..side.of.something	2323	BACK (PART)	back (side of something)	back	ʙᴀᴄᴋ	4		The backward part or surface, as of a building.	後						
660	bad:to.be	1292	BAD	to be bad	bad	ʙᴀᴅ	3		Not good; unfavorable; negative.	悪い	बुरा होना	খৰাপ	不好	မကောင်းဘူး။		
661	bag	2468	BAG	bag	bag	ʙᴀɢ	3		A container made of flexible material with an opening at the top, used for carrying or storing items.	袋	थैला	থলতী	包	အိတ်		
666	bald:to.be	1125	BALD	to be bald	bald	ʙᴀʟᴅ	4		Without hair on the head.	禿頭	गंजा होना	উলোহ	秃头	ထိပ်ပြောင်ခြင်း။		
667	bamboo	1927	BAMBOO	bamboo	bamboo	ʙᴀᴍʙᴏᴏ	1	flora	A group of woody perennial evergreen plants in the true grass family Poaceae, subfamily Bambusoideae, tribe Bambuseae.	竹	बांस	ভেতি	竹子	ဝါး		
669	bamboo.shoot	2494	BAMBOO SHOOT	bamboo shoot	bamboo.shoot	ʙᴀᴍʙᴏᴏ.ꜱʜᴏᴏᴛ	2	flora	The edible shoots (new bamboo culms that come out of the ground) of many bamboo species // Often harvested as part of local cuisine, either used fresh, dried or fermented.	竹の子	बांस की खोखली	কাজি কেচেক	竹笋	မျှစ်		
671	bamboo.skin	–	–	bamboo skin	bamboo.skin	ʙᴀᴍʙᴏᴏ.ꜱᴋɪɴ	4	flora	The outer layer of a bamboo stalk, often used for making baskets and other woven goods.		बांस की छाल	ভেতি তামুল	竹皮	ဝါးအရေပြား		
672	bamboo.strip	–	–	bamboo strip	bamboo.strip	ʙᴀᴍʙᴏᴏ.ꜱᴛʀɪᴘ	4	flora	A long, thin piece of bamboo used for various purposes.		बांस की पट्टी		竹片	ဝါးချွတ်		
674	bamboo.tube	–	–	bamboo tube	bamboo.tube	ʙᴀᴍʙᴏᴏ.ᴛᴜʙᴇ	4	flora	A hollow tube made from a bamboo plant, used for carrying water, as a musical instrument, or for other utilitarian purposes.		बांस का छलनी	বাঁহৰ নলী	竹筒	ဝါးပြွန်		
677	banana..fruit	868	BANANA	banana (fruit)	banana	ʙᴀɴᴀɴᴀ	2	flora	The fruit of the banana tree.	バナナ	केला	কল	香蕉	ငှက်ပျောသီး		
678	banana.tree	1795	BANANA TREE	banana tree	banana.tree	ʙᴀɴᴀɴᴀ.ᴛʀᴇᴇ	3	flora	The tropical treelike plant which bears clusters of bananas. The plant, of the genus Musa, has large, elongated leaves.							
679	banyan..tree	346	BANYAN	banyan (tree)	banyan	ʙᴀɴʏᴀɴ	2	flora	A large, tropical tree belonging to the genus Ficus, typically Ficus benghalensis, with aerial roots that grow into new trunks, often used for shade or as a spiritual symbol in many cultures.		बरगद		榕树	ညောင်ပင်		
680	barbet:great	–	–	great barbet	great.barbet	ɢʀᴇᴀᴛ.ʙᴀʀʙᴇᴛ	2									
683	bark..dog:to	1206	BARKING	to bark (dog)	bark	ʙᴀʀᴋ	4		The loud often sharp vocalisation of a domestic dog.	吠える	भौंकना		狗叫	ခွေးဟောင်ခြင်း၊		
686	basket:firewood	–	–	firewood basket	firewood.basket	ꜰɪʀᴇᴡᴏᴏᴅ.ʙᴀꜱᴋᴇᴛ	4	artefacts	A basket primarily used for carrying firewood.							
687	basket:rice	–	–	rice basket	rice.basket	ʀɪᴄᴇ.ʙᴀꜱᴋᴇᴛ	4	artefacts	The type of basket primarily used to carry paddy.							cf Mossang kən₂lɨŋ₂ smallest basket
688	basket:small	–	–	small basket	small.basket	ꜱᴍᴀʟʟ.ʙᴀꜱᴋᴇᴛ	4	artefacts	Any particularly small basket.							
690	basket..general	1539	BASKET	basket (general)	basket	ʙᴀꜱᴋᴇᴛ	2	artefacts	The general term for any kind of basket, a container woven typically from cane or bamboo used to store or carry many different kinds of items or materials.	籠						cf Chang _kam_
692	bat..animal	1793	BAT	bat (animal)	bat	ʙᴀᴛ	1	fauna	A small, flying mammal in the order Chiroptera with wings consisting of skin stretched over a framework of bones, typically active at night.	蝙蝠	चमगादड़		蝙蝠	လင်းနို့		
698	beak..bill	73	BEAK	beak (bill)	beak	ʙᴇᴀᴋ	4	body parts	The hard, pointed mouthpart of a bird, used for eating, grooming, and other activities.	くちばし	चोंच		鸟嘴	နှုတ်သီး		
699	beam..rafter	1132	BEAM	beam (rafter)	beam	ʙᴇᴀᴍ	4		A typically horizontal piece of wood or steel that supports the weight of a building, typically running from one side of the building to the other.	梁	खंभा		房梁	အိမ်တစ်အိမ်၏အလင်းတန်း		
701	bean..general	832	BEAN	bean (general)	bean	ʙᴇᴀɴ	2		Any of various leguminous plants grown for their edible seeds and pods.	豆						
704	bear..animal	1820	BEAR	bear (animal)	bear	ʙᴇᴀʀ	2		A large beast of prey of the family Ursidae, related to the dog and raccoon, having shaggy hair, a very small tail, and flat feet.	熊	भालू		熊	ဝက်ဝံ		
707	bear..fruit:to	3054	BEAR FRUIT	to bear (fruit)	bear	ʙᴇᴀʀ	4		To produce or yield fruits.							
708	beard	678	BEARD	beard	beard	ʙᴇᴀʀᴅ	4	body parts	Facial hair of humans on the chin, cheeks and jaw.		दाढ़ी		胡须	မုတ်ဆိတ်မွေး		
709	beat..someone:to	1665	BEAT	to beat (someone)	beat	ʙᴇᴀᴛ	4		To strike or pound repeatedly, usually in some sort of rhythm.							
714	bed	1663	BED	bed	bed	ʙᴇᴅ	3		A piece of furniture used for sleeping or resting, typically consisting of a mattress and a frame.	寝台	बिस्तर		床	အိပ်ရာ		
716	bee::hive	88	BEEHIVE	beehive	beehive	ʙᴇᴇʜɪᴠᴇ	3	fauna	A structure that provides a natural habitation for bees; as in a hollow tree.							
717	bee::s::wax	1931	BEESWAX	beeswax	beeswax	ʙᴇᴇꜱᴡᴀx	4	fauna	A yellowish or dark brown wax secreted by honeybees for constructing honeycombs.							
718	bee..general	665	BEE	bee (general)	bee	ʙᴇᴇ	0	fauna	Any pollenating flying insect belonging to the Anthophila clade within the order Hymenoptera. Typically having yellow and black colouring with a striped pattern on the abdoment.	蜂	मधुमक्खी		蜜蜂	ပျား		
